{
 "schema_version": 1,
 "kind": "off_to_polar_reweight",
 "source_model": "",
 "target_model": "/workspace/group/shared/bza/task3_sampling_database/mlip/models/mace-polar/MACE-POLAR-1-M.model",
 "source_sha256": "",
 "target_sha256": "",
 "temperature_K": 334.0,
 "beta_eV_inv": 34.74406623277122,
 "n_frames": 36,
 "n_atoms": 96,
 "constant_offset_meV_per_atom": 416.62069353605636,
 "delta_meV_per_atom_std": 1.1664712238052923,
 "sigma_beta": 3.8906835320172104,
 "ess": 3.6270322247424427,
 "ess_fraction": 0.10075089513173452,
 "linear": {
  "c1": 0.9452475805455269,
  "c2_total_eV": -3606.8371601425606,
  "r2": 0.986606562334491,
  "residual_rms_meV_per_atom": 1.029904086602515
 },
 "force_mae_meV_per_A_mean": 104.69303975712768,
 "verdict": "marginal",
 "frames": [
  {
   "index": 0,
   "n_atoms": 96,
   "e_source_eV": -66604.4375,
   "e_target_eV": -66564.63228754244,
   "dE_total_eV": 39.80521245756245,
   "dE_meV_per_atom": 414.6376297662755,
   "beta_dE": 1382.9949380350797,
   "weight": 0.13710089641691148,
   "force_mae_meV_per_A": 104.48991706899761
  },
  {
   "index": 1,
   "n_atoms": 96,
   "e_source_eV": -66604.4765625,
   "e_target_eV": -66564.7044285027,
   "dE_total_eV": 39.77213399730681,
   "dE_meV_per_atom": 414.2930624719459,
   "beta_dE": 1381.8456578210796,
   "weight": 0.43267953019694844,
   "force_mae_meV_per_A": 105.45036893450111
  },
  {
   "index": 2,
   "n_atoms": 96,
   "e_source_eV": -66604.1484375,
   "e_target_eV": -66564.08303814566,
   "dE_total_eV": 40.0653993543383,
   "dE_meV_per_atom": 417.34790994102394,
   "beta_dE": 1392.0348888095589,
   "weight": 1.6256968204823706e-05,
   "force_mae_meV_per_A": 100.64638378247795
  },
  {
   "index": 3,
   "n_atoms": 96,
   "e_source_eV": -66603.8203125,
   "e_target_eV": -66563.92910589393,
   "dE_total_eV": 39.891206606072956,
   "dE_meV_per_atom": 415.5334021465933,
   "beta_dE": 1385.9827244265596,
   "weight": 0.006909731176544039,
   "force_mae_meV_per_A": 102.93354914548652
  },
  {
   "index": 4,
   "n_atoms": 96,
   "e_source_eV": -66604.71875,
   "e_target_eV": -66564.75188830124,
   "dE_total_eV": 39.96686169876193,
   "dE_meV_per_atom": 416.3214760287701,
   "beta_dE": 1388.6112899777918,
   "weight": 0.0004987577272082987,
   "force_mae_meV_per_A": 107.00930555514407
  },
  {
   "index": 5,
   "n_atoms": 96,
   "e_source_eV": -66604.84375,
   "e_target_eV": -66565.04564482786,
   "dE_total_eV": 39.79810517214355,
   "dE_meV_per_atom": 414.56359554316197,
   "beta_dE": 1382.7480020397502,
   "weight": 0.17550247059881938,
   "force_mae_meV_per_A": 106.85879025879392
  },
  {
   "index": 6,
   "n_atoms": 96,
   "e_source_eV": -66605.3828125,
   "e_target_eV": -66565.58758467686,
   "dE_total_eV": 39.7952278231387,
   "dE_meV_per_atom": 414.5336231576948,
   "beta_dE": 1382.648031235351,
   "weight": 0.19395456385355223,
   "force_mae_meV_per_A": 108.7119585324429
  },
  {
   "index": 7,
   "n_atoms": 96,
   "e_source_eV": -66605.6953125,
   "e_target_eV": -66565.84992522161,
   "dE_total_eV": 39.845387278386625,
   "dE_meV_per_atom": 415.056117483194,
   "beta_dE": 1384.3907746706846,
   "weight": 0.03394971602145325,
   "force_mae_meV_per_A": 108.78640443524702
  },
  {
   "index": 8,
   "n_atoms": 96,
   "e_source_eV": -66605.53125,
   "e_target_eV": -66565.5816211267,
   "dE_total_eV": 39.94962887330621,
   "dE_meV_per_atom": 416.14196743027304,
   "beta_dE": 1388.0125515487803,
   "weight": 0.0009076500440288368,
   "force_mae_meV_per_A": 108.4877287234607
  },
  {
   "index": 9,
   "n_atoms": 96,
   "e_source_eV": -66605.1875,
   "e_target_eV": -66565.2830111261,
   "dE_total_eV": 39.904488873900846,
   "dE_meV_per_atom": 415.6717591031338,
   "beta_dE": 1386.444204419693,
   "weight": 0.0043555493309916805,
   "force_mae_meV_per_A": 102.07200836010175
  },
  {
   "index": 10,
   "n_atoms": 96,
   "e_source_eV": -66605.421875,
   "e_target_eV": -66565.35055712963,
   "dE_total_eV": 40.071317870373605,
   "dE_meV_per_atom": 417.40956114972505,
   "beta_dE": 1392.2405221226895,
   "weight": 1.3235310770140222e-05,
   "force_mae_meV_per_A": 103.04747423691096
  },
  {
   "index": 11,
   "n_atoms": 96,
   "e_source_eV": -66605.75,
   "e_target_eV": -66565.7752607939,
   "dE_total_eV": 39.974739206096274,
   "dE_meV_per_atom": 416.40353339683617,
   "beta_dE": 1388.8849866143653,
   "weight": 0.00037933655716517644,
   "force_mae_meV_per_A": 105.11660299657989
  },
  {
   "index": 12,
   "n_atoms": 96,
   "e_source_eV": -66604.9765625,
   "e_target_eV": -66564.79133775193,
   "dE_total_eV": 40.18522474807105,
   "dE_meV_per_atom": 418.5960911257401,
   "beta_dE": 1396.1981102257776,
   "weight": 2.529155129960676e-07,
   "force_mae_meV_per_A": 106.73645004439315
  },
  {
   "index": 13,
   "n_atoms": 96,
   "e_source_eV": -66605.25,
   "e_target_eV": -66565.10365521586,
   "dE_total_eV": 40.14634478413791,
   "dE_meV_per_atom": 418.1910915014366,
   "beta_dE": 1394.8472621837568,
   "weight": 9.764304599876691e-07,
   "force_mae_meV_per_A": 104.06666956272738
  },
  {
   "index": 14,
   "n_atoms": 96,
   "e_source_eV": -66606.125,
   "e_target_eV": -66566.11268786363,
   "dE_total_eV": 40.0123121363722,
   "dE_meV_per_atom": 416.7949180872104,
   "beta_dE": 1390.1904229924314,
   "weight": 0.00010282077731869691,
   "force_mae_meV_per_A": 103.430330248402
  },
  {
   "index": 15,
   "n_atoms": 96,
   "e_source_eV": -66605.6171875,
   "e_target_eV": -66565.55722855969,
   "dE_total_eV": 40.05995894031366,
   "dE_meV_per_atom": 417.29123896160064,
   "beta_dE": 1391.8458667043533,
   "weight": 1.963951748541299e-05,
   "force_mae_meV_per_A": 103.04994251771981
  },
  {
   "index": 16,
   "n_atoms": 96,
   "e_source_eV": -66605.203125,
   "e_target_eV": -66565.26526251942,
   "dE_total_eV": 39.937862480583135,
   "dE_meV_per_atom": 416.01940083940764,
   "beta_dE": 1387.603739220689,
   "weight": 0.0013660398580102769,
   "force_mae_meV_per_A": 103.72412594889023
  },
  {
   "index": 17,
   "n_atoms": 96,
   "e_source_eV": -66605.640625,
   "e_target_eV": -66565.59166881932,
   "dE_total_eV": 40.048956180675304,
   "dE_meV_per_atom": 417.17662688203444,
   "beta_dE": 1391.463586094735,
   "weight": 2.878413433760298e-05,
   "force_mae_meV_per_A": 103.74189621022884
  },
  {
   "index": 18,
   "n_atoms": 96,
   "e_source_eV": -66605.8515625,
   "e_target_eV": -66565.84572990748,
   "dE_total_eV": 40.005832592520164,
   "dE_meV_per_atom": 416.7274228387517,
   "beta_dE": 1389.965297291678,
   "weight": 0.00012878098198178739,
   "force_mae_meV_per_A": 101.26932393601314
  },
  {
   "index": 19,
   "n_atoms": 96,
   "e_source_eV": -66606.3984375,
   "e_target_eV": -66566.5085392229,
   "dE_total_eV": 39.88989827710611,
   "dE_meV_per_atom": 415.5197737198553,
   "beta_dE": 1385.9372677582812,
   "weight": 0.007231072762803516,
   "force_mae_meV_per_A": 107.9353974492901
  },
  {
   "index": 20,
   "n_atoms": 96,
   "e_source_eV": -66606.203125,
   "e_target_eV": -66566.19566574355,
   "dE_total_eV": 40.00745925644878,
   "dE_meV_per_atom": 416.74436725467484,
   "beta_dE": 1390.0218142109525,
   "weight": 0.00012170453074159291,
   "force_mae_meV_per_A": 104.10731090753903
  },
  {
   "index": 21,
   "n_atoms": 96,
   "e_source_eV": -66606.2109375,
   "e_target_eV": -66566.22067058332,
   "dE_total_eV": 39.990266916676774,
   "dE_meV_per_atom": 416.5652803820497,
   "beta_dE": 1389.4244824192174,
   "weight": 0.000221169200079828,
   "force_mae_meV_per_A": 105.32699941414494
  },
  {
   "index": 22,
   "n_atoms": 96,
   "e_source_eV": -66606.609375,
   "e_target_eV": -66566.55341045363,
   "dE_total_eV": 40.05596454636543,
   "dE_meV_per_atom": 417.24963069130655,
   "beta_dE": 1391.707085216456,
   "weight": 2.2563311959476793e-05,
   "force_mae_meV_per_A": 101.55192709841744
  },
  {
   "index": 23,
   "n_atoms": 96,
   "e_source_eV": -66606.96875,
   "e_target_eV": -66566.86994459707,
   "dE_total_eV": 40.09880540292943,
   "dE_meV_per_atom": 417.69588961384824,
   "beta_dE": 1393.1955507743844,
   "weight": 5.092962397187705e-06,
   "force_mae_meV_per_A": 107.98740447619271
  },
  {
   "index": 24,
   "n_atoms": 96,
   "e_source_eV": -66606.4453125,
   "e_target_eV": -66566.48187659199,
   "dE_total_eV": 39.96343590800825,
   "dE_meV_per_atom": 416.28579070841926,
   "beta_dE": 1388.4922640769462,
   "weight": 0.000561800251354423,
   "force_mae_meV_per_A": 104.79229810851838
  },
  {
   "index": 25,
   "n_atoms": 96,
   "e_source_eV": -66606.4453125,
   "e_target_eV": -66566.4535235585,
   "dE_total_eV": 39.99178894149372,
   "dE_meV_per_atom": 416.5811348072263,
   "beta_dE": 1389.4773637502656,
   "weight": 0.00020977734131259813,
   "force_mae_meV_per_A": 102.71542565487923
  },
  {
   "index": 26,
   "n_atoms": 96,
   "e_source_eV": -66606.6328125,
   "e_target_eV": -66566.69866118945,
   "dE_total_eV": 39.93415131054644,
   "dE_meV_per_atom": 415.9807428181921,
   "beta_dE": 1387.474798083133,
   "weight": 0.0015540385784740104,
   "force_mae_meV_per_A": 102.59792726317501
  },
  {
   "index": 27,
   "n_atoms": 96,
   "e_source_eV": -66606.65625,
   "e_target_eV": -66566.71718999372,
   "dE_total_eV": 39.93906000627612,
   "dE_meV_per_atom": 416.03187506537625,
   "beta_dE": 1387.6453461326817,
   "weight": 0.0013103693281470224,
   "force_mae_meV_per_A": 104.18259135659922
  },
  {
   "index": 28,
   "n_atoms": 96,
   "e_source_eV": -66606.609375,
   "e_target_eV": -66566.43925520689,
   "dE_total_eV": 40.17011979311064,
   "dE_meV_per_atom": 418.43874784490254,
   "beta_dE": 1395.6733026701902,
   "weight": 4.2746099644016724e-07,
   "force_mae_meV_per_A": 104.44185413266453
  },
  {
   "index": 29,
   "n_atoms": 96,
   "e_source_eV": -66606.71875,
   "e_target_eV": -66566.76241754873,
   "dE_total_eV": 39.95633245127101,
   "dE_meV_per_atom": 416.21179636740635,
   "beta_dE": 1388.245461105586,
   "weight": 0.0007190632573239846,
   "force_mae_meV_per_A": 105.31672000146791
  },
  {
   "index": 30,